{
  "$schema": "https://json-schema.org/draft/2020-12/schema",
  "type": "object",
  "additionalProperties": false,
  "required": [
    "id",
    "paper_id",
    "code_id",
    "claim_type",
    "title",
    "context",
    "claim",
    "provenance",
    "uncertainty_flags"
  ],
  "properties": {
    "id": { "type": "string", "minLength": 1 },
    "paper_id": { "type": "string", "minLength": 1 },
    "code_id": { "type": "string", "minLength": 1 },
    "claim_type": {
      "enum": [
        "construction_note",
        "parameter_claim",
        "decoder_claim",
        "distance_claim",
        "threshold_evidence",
        "relation_claim"
      ]
    },
    "title": { "type": "string", "minLength": 1 },
    "context": {
      "type": "object",
      "additionalProperties": false,
      "required": ["noise_model", "decoder", "distance_method", "assumptions", "parameter_point"],
      "properties": {
        "noise_model": { "type": ["string", "null"] },
        "decoder": { "type": ["string", "null"] },
        "distance_method": { "type": ["string", "null"] },
        "assumptions": {
          "type": "array",
          "items": { "type": "string" }
        },
        "parameter_point": {
          "type": "object",
          "additionalProperties": true
        }
      }
    },
    "claim": {
      "type": "object",
      "additionalProperties": false,
      "required": ["statement", "value", "unit", "qualifiers"],
      "properties": {
        "statement": { "type": "string", "minLength": 1 },
        "value": {},
        "unit": { "type": ["string", "null"] },
        "qualifiers": {
          "type": "array",
          "items": { "type": "string" }
        }
      }
    },
    "provenance": {
      "type": "object",
      "additionalProperties": false,
      "required": ["section", "quote_ref", "confidence"],
      "properties": {
        "section": { "type": "string", "minLength": 1 },
        "quote_ref": { "type": "string", "minLength": 1 },
        "confidence": { "enum": ["low", "medium", "high"] }
      }
    },
    "uncertainty_flags": {
      "type": "array",
      "items": {
        "enum": [
          "unresolved_code_identity",
          "conflicting_claims",
          "insufficient_evidence",
          "schema_valid_but_semantically_uncertain"
        ]
      }
    }
  }
}
